{
  "$schema": "https://json-schema.org/draft/2020-12/schema",
  "$id": "urn:ddn:schema:icon-pack:1",
  "title": "DDN icon pack (ddn-icon-pack@1)",
  "description": "Normative schema for a DDN icon pack: a single self-contained JSON document pairing a manifest (identity, license, attribution, source) with a set of inline stroke-SVG icons. See standard/specification/49-icon-packs.md for the prose specification, including the sanitization requirements every consumer must enforce.",
  "type": "object",
  "required": ["format", "id", "name", "version", "license", "attribution", "source", "grid", "icons"],
  "additionalProperties": false,
  "properties": {
    "format": { "const": "ddn-icon-pack@1" },
    "id": {
      "type": "string",
      "pattern": "^[a-z0-9][a-z0-9-]*@[0-9]+$",
      "description": "Pack namespace: lowercase letters, digits and hyphens, an @-separator and a numeric major version. Icons are referenced as <pack-id>/<icon-id>."
    },
    "name": { "type": "string", "minLength": 1 },
    "version": {
      "type": "string",
      "pattern": "^[0-9]+\\.[0-9]+\\.[0-9]+$",
      "description": "Semantic version of the pack document. Icon removals or renames require a new pack major version (a new @N id), never an in-place edit."
    },
    "license": {
      "type": "string",
      "minLength": 1,
      "description": "SPDX identifier of the icon artwork license (for example MIT or GPL-2.0-or-later)."
    },
    "attribution": { "type": "string", "minLength": 1, "description": "Copyright holder and project credit as it must appear in derivative notices." },
    "source": { "type": "string", "minLength": 1, "description": "Canonical upstream location of the artwork (URL or repository path)." },
    "licenseText": { "type": "string", "minLength": 1, "description": "Full license text. Required whenever the license demands redistribution of the text (for example MIT); optional otherwise." },
    "note": { "type": "string", "description": "Free-form scope note: curation stance, disclaimers, omissions." },
    "grid": {
      "type": "object",
      "required": ["size", "strokeWidth"],
      "additionalProperties": false,
      "properties": {
        "size": { "type": "integer", "minimum": 8, "description": "Edge of the square icon grid; every icon's viewBox must be '0 0 <size> <size>'." },
        "strokeWidth": { "type": "number", "exclusiveMinimum": 0, "description": "Nominal stroke width shared by the pack's icons, in grid units." },
        "linecap": { "enum": ["butt", "round", "square"] },
        "linejoin": { "enum": ["miter", "round", "bevel"] }
      }
    },
    "icons": {
      "type": "array",
      "minItems": 1,
      "maxItems": 400,
      "items": { "$ref": "#/$defs/icon" }
    }
  },
  "$defs": {
    "icon": {
      "type": "object",
      "required": ["id", "name", "svg"],
      "additionalProperties": false,
      "properties": {
        "id": {
          "type": "string",
          "pattern": "^[a-z0-9][a-z0-9-]*$",
          "description": "Icon identifier, unique within the pack."
        },
        "name": { "type": "string", "minLength": 1 },
        "svg": {
          "type": "string",
          "maxLength": 20480,
          "description": "Complete inline SVG document, stroke-based, self-contained (no external references, scripts, event handlers or foreignObject — consumers reject it otherwise). At most 20 KiB."
        },
        "kinds": {
          "type": "array",
          "items": { "type": "string", "minLength": 1 },
          "description": "DDN element kinds this icon binds to by default; omit or leave empty for override-only icons."
        },
        "tags": {
          "type": "array",
          "items": { "type": "string", "minLength": 1 },
          "description": "Free-form classification for search and curation."
        }
      }
    }
  }
}
