{
  "format": "ddn-icon-pack@1",
  "id": "network-generic@1",
  "name": "Generic network infrastructure (agent-drawn)",
  "version": "1.0.0",
  "license": "GPL-2.0-or-later",
  "attribution": "DDN contributors (agent-drawn artwork)",
  "source": "https://github.com/scratchbird-software-inc/Diagram-Design-Notation",
  "licenseText": "GPL-2.0-or-later. Agent-drawn for the Diagram Design Notation project; copyright the DDN contributors.",
  "note": "Common-practice rendering \u2014 compliance against the governing standard pending document review. Generic glyphs only; vendor packs (Cisco/AWS/Azure/GCP) excluded pending licensing diligence.",
  "grid": {
    "size": 24,
    "strokeWidth": 1.6,
    "linecap": "round",
    "linejoin": "round"
  },
  "icons": [
    {
      "id": "router",
      "name": "Router",
      "kinds": [],
      "svg": "<svg xmlns=\"http://www.w3.org/2000/svg\" viewBox=\"0 0 24 24\" fill=\"none\" stroke=\"currentColor\" stroke-width=\"1.6\" stroke-linecap=\"round\" stroke-linejoin=\"round\"><rect x=\"3\" y=\"10\" width=\"18\" height=\"5.5\" rx=\"1.4\"/><path d=\"M7 7l2.5 2.5M9.5 7L7 9.5M14.5 18l2.5-2.5M17 18l-2.5-2.5\"/></svg>"
    },
    {
      "id": "switch",
      "name": "Switch",
      "kinds": [
        "network.switch"
      ],
      "svg": "<svg xmlns=\"http://www.w3.org/2000/svg\" viewBox=\"0 0 24 24\" fill=\"none\" stroke=\"currentColor\" stroke-width=\"1.6\" stroke-linecap=\"round\" stroke-linejoin=\"round\"><rect x=\"3\" y=\"10\" width=\"18\" height=\"5.5\" rx=\"1.4\"/><path d=\"M6 7h5M9 5l2 2-2 2M18 18h-5M15 16l-2 2 2 2\"/></svg>"
    },
    {
      "id": "firewall",
      "name": "Firewall",
      "kinds": [],
      "svg": "<svg xmlns=\"http://www.w3.org/2000/svg\" viewBox=\"0 0 24 24\" fill=\"none\" stroke=\"currentColor\" stroke-width=\"1.6\" stroke-linecap=\"round\" stroke-linejoin=\"round\"><rect x=\"4\" y=\"5\" width=\"16\" height=\"14\"/><path d=\"M4 9.7h16M4 14.3h16M10 5v4.7M16 5v4.7M7 9.7v4.6M13 9.7v4.6M10 14.3V19M16 14.3V19\"/></svg>"
    },
    {
      "id": "load-balancer",
      "name": "Load balancer",
      "kinds": [],
      "svg": "<svg xmlns=\"http://www.w3.org/2000/svg\" viewBox=\"0 0 24 24\" fill=\"none\" stroke=\"currentColor\" stroke-width=\"1.6\" stroke-linecap=\"round\" stroke-linejoin=\"round\"><circle cx=\"12\" cy=\"6\" r=\"2.4\"/><path d=\"M12 8.4v4M12 12.4l-6 5M12 12.4l6 5\"/><circle cx=\"5\" cy=\"18.5\" r=\"1.8\"/><circle cx=\"19\" cy=\"18.5\" r=\"1.8\"/></svg>"
    },
    {
      "id": "server",
      "name": "Server",
      "kinds": [
        "network.server"
      ],
      "svg": "<svg xmlns=\"http://www.w3.org/2000/svg\" viewBox=\"0 0 24 24\" fill=\"none\" stroke=\"currentColor\" stroke-width=\"1.6\" stroke-linecap=\"round\" stroke-linejoin=\"round\"><rect x=\"4\" y=\"4\" width=\"16\" height=\"6\" rx=\"1\"/><rect x=\"4\" y=\"14\" width=\"16\" height=\"6\" rx=\"1\"/><circle cx=\"7\" cy=\"7\" r=\".8\" fill=\"currentColor\"/><circle cx=\"7\" cy=\"17\" r=\".8\" fill=\"currentColor\"/></svg>"
    },
    {
      "id": "database",
      "name": "Database",
      "kinds": [
        "network.rack"
      ],
      "svg": "<svg xmlns=\"http://www.w3.org/2000/svg\" viewBox=\"0 0 24 24\" fill=\"none\" stroke=\"currentColor\" stroke-width=\"1.6\" stroke-linecap=\"round\" stroke-linejoin=\"round\"><ellipse cx=\"12\" cy=\"5.5\" rx=\"7\" ry=\"2.5\"/><path d=\"M5 5.5v13c0 1.4 3.1 2.5 7 2.5s7-1.1 7-2.5v-13\"/><path d=\"M5 12c0 1.4 3.1 2.5 7 2.5s7-1.1 7-2.5\"/></svg>"
    },
    {
      "id": "storage",
      "name": "Storage array",
      "kinds": [],
      "svg": "<svg xmlns=\"http://www.w3.org/2000/svg\" viewBox=\"0 0 24 24\" fill=\"none\" stroke=\"currentColor\" stroke-width=\"1.6\" stroke-linecap=\"round\" stroke-linejoin=\"round\"><rect x=\"4\" y=\"7\" width=\"16\" height=\"10\" rx=\"1.5\"/><circle cx=\"9\" cy=\"12\" r=\"3\"/><path d=\"M15.5 10v4\"/></svg>"
    },
    {
      "id": "cloud",
      "name": "Cloud",
      "kinds": [
        "network.bus"
      ],
      "svg": "<svg xmlns=\"http://www.w3.org/2000/svg\" viewBox=\"0 0 24 24\" fill=\"none\" stroke=\"currentColor\" stroke-width=\"1.6\" stroke-linecap=\"round\" stroke-linejoin=\"round\"><path d=\"M6.5 17a4.5 4.5 0 1 1 .4-8.98A6 6 0 0 1 18.5 10a3.75 3.75 0 0 1-.5 7z\"/></svg>"
    },
    {
      "id": "user",
      "name": "User",
      "kinds": [],
      "svg": "<svg xmlns=\"http://www.w3.org/2000/svg\" viewBox=\"0 0 24 24\" fill=\"none\" stroke=\"currentColor\" stroke-width=\"1.6\" stroke-linecap=\"round\" stroke-linejoin=\"round\"><circle cx=\"12\" cy=\"8\" r=\"3.5\"/><path d=\"M5 20c1.5-3.5 4-5 7-5s5.5 1.5 7 5\"/></svg>"
    },
    {
      "id": "workstation",
      "name": "Workstation",
      "kinds": [],
      "svg": "<svg xmlns=\"http://www.w3.org/2000/svg\" viewBox=\"0 0 24 24\" fill=\"none\" stroke=\"currentColor\" stroke-width=\"1.6\" stroke-linecap=\"round\" stroke-linejoin=\"round\"><rect x=\"3\" y=\"4\" width=\"18\" height=\"12\" rx=\"1\"/><path d=\"M9 20h6M12 16v4\"/></svg>"
    },
    {
      "id": "laptop",
      "name": "Laptop",
      "kinds": [],
      "svg": "<svg xmlns=\"http://www.w3.org/2000/svg\" viewBox=\"0 0 24 24\" fill=\"none\" stroke=\"currentColor\" stroke-width=\"1.6\" stroke-linecap=\"round\" stroke-linejoin=\"round\"><rect x=\"6\" y=\"5\" width=\"12\" height=\"9\"/><path d=\"M3 18l2-4h14l2 4z\"/></svg>"
    },
    {
      "id": "phone",
      "name": "Desk phone",
      "kinds": [],
      "svg": "<svg xmlns=\"http://www.w3.org/2000/svg\" viewBox=\"0 0 24 24\" fill=\"none\" stroke=\"currentColor\" stroke-width=\"1.6\" stroke-linecap=\"round\" stroke-linejoin=\"round\"><rect x=\"6\" y=\"4\" width=\"12\" height=\"7\" rx=\"1\"/><path d=\"M9 11v6M15 11v6M7 20h10M7 17h10\"/></svg>"
    },
    {
      "id": "mobile",
      "name": "Mobile phone",
      "kinds": [],
      "svg": "<svg xmlns=\"http://www.w3.org/2000/svg\" viewBox=\"0 0 24 24\" fill=\"none\" stroke=\"currentColor\" stroke-width=\"1.6\" stroke-linecap=\"round\" stroke-linejoin=\"round\"><rect x=\"8\" y=\"3\" width=\"8\" height=\"18\" rx=\"1.5\"/><path d=\"M11 18h2\"/></svg>"
    },
    {
      "id": "printer",
      "name": "Printer",
      "kinds": [],
      "svg": "<svg xmlns=\"http://www.w3.org/2000/svg\" viewBox=\"0 0 24 24\" fill=\"none\" stroke=\"currentColor\" stroke-width=\"1.6\" stroke-linecap=\"round\" stroke-linejoin=\"round\"><path d=\"M7 9V4h10v5\"/><rect x=\"4\" y=\"9\" width=\"16\" height=\"7\" rx=\"1\"/><rect x=\"7\" y=\"14\" width=\"10\" height=\"6\"/></svg>"
    },
    {
      "id": "wifi-ap",
      "name": "Wireless access point",
      "kinds": [],
      "svg": "<svg xmlns=\"http://www.w3.org/2000/svg\" viewBox=\"0 0 24 24\" fill=\"none\" stroke=\"currentColor\" stroke-width=\"1.6\" stroke-linecap=\"round\" stroke-linejoin=\"round\"><circle cx=\"12\" cy=\"18\" r=\"1\" fill=\"currentColor\"/><path d=\"M7 14a7 7 0 0 1 10 0M4 10.5a11.5 11.5 0 0 1 16 0M1.5 7a16 16 0 0 1 21 0\"/></svg>"
    },
    {
      "id": "antenna",
      "name": "Antenna",
      "kinds": [],
      "svg": "<svg xmlns=\"http://www.w3.org/2000/svg\" viewBox=\"0 0 24 24\" fill=\"none\" stroke=\"currentColor\" stroke-width=\"1.6\" stroke-linecap=\"round\" stroke-linejoin=\"round\"><path d=\"M9 21l3-13 3 13\"/><circle cx=\"12\" cy=\"6.5\" r=\"1.4\"/><path d=\"M8 4a6 6 0 0 1 8 0\"/></svg>"
    },
    {
      "id": "globe",
      "name": "Globe / WAN",
      "kinds": [],
      "svg": "<svg xmlns=\"http://www.w3.org/2000/svg\" viewBox=\"0 0 24 24\" fill=\"none\" stroke=\"currentColor\" stroke-width=\"1.6\" stroke-linecap=\"round\" stroke-linejoin=\"round\"><circle cx=\"12\" cy=\"12\" r=\"9\"/><path d=\"M3 12h18M12 3c3 3.5 3 14.5 0 18M12 3c-3 3.5-3 14.5 0 18\"/></svg>"
    },
    {
      "id": "link",
      "name": "Link segment",
      "kinds": [],
      "svg": "<svg xmlns=\"http://www.w3.org/2000/svg\" viewBox=\"0 0 24 24\" fill=\"none\" stroke=\"currentColor\" stroke-width=\"1.6\" stroke-linecap=\"round\" stroke-linejoin=\"round\"><path d=\"M4 12h16\"/><circle cx=\"4\" cy=\"12\" r=\"1.4\"/><circle cx=\"20\" cy=\"12\" r=\"1.4\"/></svg>"
    },
    {
      "id": "link-wireless",
      "name": "Wireless link",
      "kinds": [],
      "svg": "<svg xmlns=\"http://www.w3.org/2000/svg\" viewBox=\"0 0 24 24\" fill=\"none\" stroke=\"currentColor\" stroke-width=\"1.6\" stroke-linecap=\"round\" stroke-linejoin=\"round\"><path d=\"M4 12h16\" stroke-dasharray=\"3 3\"/><circle cx=\"4\" cy=\"12\" r=\"1.4\"/><circle cx=\"20\" cy=\"12\" r=\"1.4\"/></svg>"
    },
    {
      "id": "hub",
      "name": "Hub / star centre",
      "kinds": [],
      "svg": "<svg xmlns=\"http://www.w3.org/2000/svg\" viewBox=\"0 0 24 24\" fill=\"none\" stroke=\"currentColor\" stroke-width=\"1.6\" stroke-linecap=\"round\" stroke-linejoin=\"round\"><circle cx=\"12\" cy=\"12\" r=\"2.4\"/><path d=\"M12 9.6V4M12 14.4V20M9.6 12H4M14.4 12H20\"/><circle cx=\"12\" cy=\"4\" r=\"1.2\"/><circle cx=\"12\" cy=\"20\" r=\"1.2\"/><circle cx=\"4\" cy=\"12\" r=\"1.2\"/><circle cx=\"20\" cy=\"12\" r=\"1.2\"/></svg>"
    }
  ]
}
