{
  "format": "ddn-icon-pack@1",
  "id": "generic-demo@1",
  "name": "Generic demo set (agent-drawn)",
  "version": "1.0.0",
  "license": "GPL-2.0-or-later",
  "attribution": "DDN contributors (agent-drawn artwork)",
  "source": "https://github.com/scratchbird-software-inc/Diagram-Design-Notation",
  "licenseText": "GPL-2.0-or-later. Agent-drawn for the Diagram Design Notation project; copyright the DDN contributors.",
  "grid": {
    "size": 24,
    "strokeWidth": 1.6,
    "linecap": "round",
    "linejoin": "round"
  },
  "icons": [
    {
      "id": "cloud",
      "name": "Cloud",
      "kinds": [
        "network.bus"
      ],
      "svg": "<svg xmlns=\"http://www.w3.org/2000/svg\" viewBox=\"0 0 24 24\" fill=\"none\" stroke=\"currentColor\" stroke-width=\"1.6\"><path d=\"M6.5 17a4.5 4.5 0 1 1 .4-8.98A6 6 0 0 1 18.5 10a3.75 3.75 0 0 1-.5 7z\"/></svg>"
    },
    {
      "id": "server",
      "name": "Server",
      "kinds": [
        "network.server"
      ],
      "svg": "<svg xmlns=\"http://www.w3.org/2000/svg\" viewBox=\"0 0 24 24\" fill=\"none\" stroke=\"currentColor\" stroke-width=\"1.6\"><rect x=\"4\" y=\"4\" width=\"16\" height=\"6\" rx=\"1\"/><rect x=\"4\" y=\"14\" width=\"16\" height=\"6\" rx=\"1\"/><circle cx=\"7\" cy=\"7\" r=\".8\" fill=\"currentColor\"/><circle cx=\"7\" cy=\"17\" r=\".8\" fill=\"currentColor\"/></svg>"
    },
    {
      "id": "database",
      "name": "Database",
      "kinds": [
        "network.rack"
      ],
      "svg": "<svg xmlns=\"http://www.w3.org/2000/svg\" viewBox=\"0 0 24 24\" fill=\"none\" stroke=\"currentColor\" stroke-width=\"1.6\"><ellipse cx=\"12\" cy=\"5.5\" rx=\"7\" ry=\"2.5\"/><path d=\"M5 5.5v13c0 1.4 3.1 2.5 7 2.5s7-1.1 7-2.5v-13\"/><path d=\"M5 12c0 1.4 3.1 2.5 7 2.5s7-1.1 7-2.5\"/></svg>"
    },
    {
      "id": "user",
      "name": "User",
      "kinds": [],
      "svg": "<svg xmlns=\"http://www.w3.org/2000/svg\" viewBox=\"0 0 24 24\" fill=\"none\" stroke=\"currentColor\" stroke-width=\"1.6\"><circle cx=\"12\" cy=\"8\" r=\"3.5\"/><path d=\"M5 20c1.5-3.5 4-5 7-5s5.5 1.5 7 5\"/></svg>"
    }
  ]
}
