{
  "format": "ddn-icon-pack@1",
  "id": "vsm-symbols@1",
  "name": "Value-stream mapping symbols (agent-drawn)",
  "version": "1.0.0",
  "license": "GPL-2.0-or-later",
  "attribution": "DDN contributors (agent-drawn artwork)",
  "source": "https://github.com/scratchbird-software-inc/Diagram-Design-Notation",
  "licenseText": "GPL-2.0-or-later. Agent-drawn for the Diagram Design Notation project; copyright the DDN contributors.",
  "note": "Common-practice rendering \u2014 compliance against the governing standard pending document review. Artwork upgrade over the built-in simple VSM glyphs.",
  "grid": {
    "size": 24,
    "strokeWidth": 1.6,
    "linecap": "round",
    "linejoin": "round"
  },
  "icons": [
    {
      "id": "process",
      "name": "Process box",
      "kinds": [
        "vsm.process"
      ],
      "svg": "<svg xmlns=\"http://www.w3.org/2000/svg\" viewBox=\"0 0 24 24\" fill=\"none\" stroke=\"currentColor\" stroke-width=\"1.6\" stroke-linecap=\"round\" stroke-linejoin=\"round\"><rect x=\"3\" y=\"6\" width=\"18\" height=\"12\"/><path d=\"M3 10h18\"/></svg>"
    },
    {
      "id": "customer",
      "name": "Customer (factory)",
      "kinds": [
        "vsm.customer"
      ],
      "svg": "<svg xmlns=\"http://www.w3.org/2000/svg\" viewBox=\"0 0 24 24\" fill=\"none\" stroke=\"currentColor\" stroke-width=\"1.6\" stroke-linecap=\"round\" stroke-linejoin=\"round\"><path d=\"M4 20V10l4.5 3V10l4.5 3V10l4.5 3v7\"/><path d=\"M2 20h20\"/><path d=\"M15.5 10V5h2v6.5\"/></svg>"
    },
    {
      "id": "supplier",
      "name": "Supplier (factory)",
      "kinds": [],
      "svg": "<svg xmlns=\"http://www.w3.org/2000/svg\" viewBox=\"0 0 24 24\" fill=\"none\" stroke=\"currentColor\" stroke-width=\"1.6\" stroke-linecap=\"round\" stroke-linejoin=\"round\"><path d=\"M20 20V10l-4.5 3V10L11 13v-3l-4.5 3v7\"/><path d=\"M2 20h20\"/></svg>"
    },
    {
      "id": "production-control",
      "name": "Production control",
      "kinds": [
        "vsm.control"
      ],
      "svg": "<svg xmlns=\"http://www.w3.org/2000/svg\" viewBox=\"0 0 24 24\" fill=\"none\" stroke=\"currentColor\" stroke-width=\"1.6\" stroke-linecap=\"round\" stroke-linejoin=\"round\"><rect x=\"4\" y=\"5\" width=\"16\" height=\"14\"/><path d=\"M4 9.7h16M4 14.3h16M9.3 5v14M14.7 5v14\"/></svg>"
    },
    {
      "id": "inventory",
      "name": "Inventory",
      "kinds": [
        "vsm.inventory"
      ],
      "svg": "<svg xmlns=\"http://www.w3.org/2000/svg\" viewBox=\"0 0 24 24\" fill=\"none\" stroke=\"currentColor\" stroke-width=\"1.6\" stroke-linecap=\"round\" stroke-linejoin=\"round\"><path d=\"M12 5l9 15H3z\"/><path d=\"M12 12v4\"/></svg>"
    },
    {
      "id": "supermarket",
      "name": "Supermarket",
      "kinds": [
        "vsm.supermarket"
      ],
      "svg": "<svg xmlns=\"http://www.w3.org/2000/svg\" viewBox=\"0 0 24 24\" fill=\"none\" stroke=\"currentColor\" stroke-width=\"1.6\" stroke-linecap=\"round\" stroke-linejoin=\"round\"><path d=\"M6 5v14M6 5h12M6 12h12M6 19h12\"/></svg>"
    },
    {
      "id": "fifo-lane",
      "name": "FIFO lane",
      "kinds": [],
      "svg": "<svg xmlns=\"http://www.w3.org/2000/svg\" viewBox=\"0 0 24 24\" fill=\"none\" stroke=\"currentColor\" stroke-width=\"1.6\" stroke-linecap=\"round\" stroke-linejoin=\"round\"><path d=\"M3 8h18M3 16h18\"/><path d=\"M14 12H5M8 9l-3 3 3 3\"/></svg>"
    },
    {
      "id": "truck",
      "name": "Truck shipment",
      "kinds": [],
      "svg": "<svg xmlns=\"http://www.w3.org/2000/svg\" viewBox=\"0 0 24 24\" fill=\"none\" stroke=\"currentColor\" stroke-width=\"1.6\" stroke-linecap=\"round\" stroke-linejoin=\"round\"><path d=\"M2 16V8h11v8M13 11h5l3 3v2h-8\"/><circle cx=\"7\" cy=\"17.5\" r=\"1.6\"/><circle cx=\"17\" cy=\"17.5\" r=\"1.6\"/></svg>"
    },
    {
      "id": "push-arrow",
      "name": "Push arrow",
      "kinds": [],
      "svg": "<svg xmlns=\"http://www.w3.org/2000/svg\" viewBox=\"0 0 24 24\" fill=\"none\" stroke=\"currentColor\" stroke-width=\"1.6\" stroke-linecap=\"round\" stroke-linejoin=\"round\"><path d=\"M3 10h12v4H3z\"/><path d=\"M15 8l6 4-6 4z\"/></svg>"
    },
    {
      "id": "pull",
      "name": "Pull arrow",
      "kinds": [],
      "svg": "<svg xmlns=\"http://www.w3.org/2000/svg\" viewBox=\"0 0 24 24\" fill=\"none\" stroke=\"currentColor\" stroke-width=\"1.6\" stroke-linecap=\"round\" stroke-linejoin=\"round\"><path d=\"M21 12H8M13 7l-5 5 5 5\"/></svg>"
    },
    {
      "id": "einfo",
      "name": "Electronic information",
      "kinds": [],
      "svg": "<svg xmlns=\"http://www.w3.org/2000/svg\" viewBox=\"0 0 24 24\" fill=\"none\" stroke=\"currentColor\" stroke-width=\"1.6\" stroke-linecap=\"round\" stroke-linejoin=\"round\"><path d=\"M3 16l4-6 3 5 3.5-7 3 5 4.5-6\"/></svg>"
    },
    {
      "id": "minfo",
      "name": "Manual information",
      "kinds": [],
      "svg": "<svg xmlns=\"http://www.w3.org/2000/svg\" viewBox=\"0 0 24 24\" fill=\"none\" stroke=\"currentColor\" stroke-width=\"1.6\" stroke-linecap=\"round\" stroke-linejoin=\"round\"><path d=\"M3 12h18\" stroke-dasharray=\"4 3\"/><path d=\"M17 9l3 3-3 3\"/></svg>"
    },
    {
      "id": "kaizen",
      "name": "Kaizen burst",
      "kinds": [
        "vsm.kaizen"
      ],
      "svg": "<svg xmlns=\"http://www.w3.org/2000/svg\" viewBox=\"0 0 24 24\" fill=\"none\" stroke=\"currentColor\" stroke-width=\"1.6\" stroke-linecap=\"round\" stroke-linejoin=\"round\"><path d=\"M12 3l1.8 4.2L18 5.5l-1.7 4.2L20.5 12l-4.2 1.8L18 18l-4.2-1.7L12 20.5l-1.8-4.2L6 18l1.7-4.2L3.5 12l4.2-1.8L6 6l4.2 1.7z\"/></svg>"
    },
    {
      "id": "operator",
      "name": "Operator",
      "kinds": [
        "vsm.operator"
      ],
      "svg": "<svg xmlns=\"http://www.w3.org/2000/svg\" viewBox=\"0 0 24 24\" fill=\"none\" stroke=\"currentColor\" stroke-width=\"1.6\" stroke-linecap=\"round\" stroke-linejoin=\"round\"><circle cx=\"12\" cy=\"7\" r=\"3\"/><path d=\"M6 20c1-4 3.2-6 6-6s5 2 6 6\"/></svg>"
    },
    {
      "id": "timeline",
      "name": "Timeline ladder",
      "kinds": [],
      "svg": "<svg xmlns=\"http://www.w3.org/2000/svg\" viewBox=\"0 0 24 24\" fill=\"none\" stroke=\"currentColor\" stroke-width=\"1.6\" stroke-linecap=\"round\" stroke-linejoin=\"round\"><path d=\"M4 4v6h8v4h8v6\"/></svg>"
    },
    {
      "id": "safety-stock",
      "name": "Safety / buffer stock",
      "kinds": [],
      "svg": "<svg xmlns=\"http://www.w3.org/2000/svg\" viewBox=\"0 0 24 24\" fill=\"none\" stroke=\"currentColor\" stroke-width=\"1.6\" stroke-linecap=\"round\" stroke-linejoin=\"round\"><path d=\"M12 4l9 16H3z\"/><path d=\"M14 12h-3.2a1.7 1.7 0 0 0 0 3.4h2.4a1.7 1.7 0 0 1 0 3.4H10\"/></svg>"
    }
  ]
}
